id,product_name,company_name,manufacturing_date,expiration_date,serial_number,storage_instructions
6029,sit,Carvalho e Filhos,2023-02-10,2066-02-17,R995 RO60 7350 78I2 N2S0 YCIS FJ9M,Vitae hic dolore et ipsa necessitatibus. Id est officiis hic iusto recusandae atque exercitationem.
9492,asperiores,Carvalho e Filhos,2023-07-10,2095-08-03,3K59 NQ9M 3701 518N H1M5 M5CI U25P,Quos perspiciatis excepturi quae. Molestias a natus aut reiciendis. Cum iste atque nihil molestias harum veritatis.
1733,aliquid,Carvalho e Filhos,2023-06-03,2094-10-11,LI86 401I 0335 5886 E351 PMZQ Z02E,Libero totam incidunt ipsa quia. Perferendis voluptate voluptas provident.
8854,ea,Campos Cavalcanti - ME,2023-09-19,2024-01-26,ZB85 SYOR 4811 70QD D1M7 65QP WM9Q,A in ducimus neque rem. Eligendi ab quae dignissimos rerum. Ab asperiores architecto maiores ipsam ea.
5230,harum,Lima,2023-01-24,2046-12-26,T939 4XXD 5887 2TIQ N0X1 D6Z9 9Y6E,Ut quod id deserunt. Blanditiis ea sunt dignissimos quae accusamus. Voluptas commodi ipsam aut.
