id,product_name,company_name,manufacturing_date,expiration_date,serial_number,storage_instructions
7899,illo,Cunha S.A.,2023-04-01,2118-09-04,3Z35 HKJC 2832 1UX4 G3Y2 3GFN 0Y16,Non earum numquam minima reprehenderit dolorem. Voluptatem tempora temporibus modi ullam cupiditate tempora. Minima doloremque iure soluta deserunt.
5813,perspiciatis,Cunha S.A.,2023-03-20,2033-01-01,EO93 V6HL 0122 8W9D S5O6 88X5 SL58,Assumenda magni sunt fuga praesentium. Reprehenderit rerum nulla cum sunt. Facilis fugiat eius recusandae voluptate voluptas ducimus non.
4307,odio,Cunha S.A.,2023-07-20,2079-07-13,TO53 D89S 0818 8324 J2I3 OU4K 2U52,Amet omnis est eius autem quibusdam. Est aut saepe perferendis adipisci pariatur. Repellat distinctio rem quas aliquid.
3061,accusantium,Rezende S/A,2023-07-20,2024-01-27,DS08 PA1E 7447 2ZAG U8S9 HDSR 090D,Aperiam omnis harum ab quia ratione. Sed doloremque quod quaerat repudiandae enim ad. Tempore sequi possimus eveniet iusto dolores. Atque molestias dignissimos similique labore.
5420,illum,Rocha,2023-01-25,2060-11-05,6704 CQXR 4018 8MGA G891 MFF1 8K71,Accusamus qui sunt ratione. Non natus excepturi.
